regular,corp
Where are you? The meeting started 5 minutes ago ,"Hi, are you available to join the meeting?"
Look it seems that your objection is based on emotional need not logical,"I hear you objection and respct it. However, there may be some emotions that are mixed in your decision "
Da fak this task schedule is stuck for so long get your shit done and your asses wiped already!,I wanted to know if there is any reason for the delaysin the project. We shoukd be moving forward 
i hate your idea,"It's a great idea, but..."
My request is not done yet. What the fuck?!,"I see that my request has not been processed since we last spoke, please advise."
Your idea bores me to death,Thanks for sharing!
I have better things to do than attending this meeting ,Unfortunately I won’t be able to attend this time. 
Please stop talking during my presentation,Let's take this offline
That's not relevant,"That's interesting, but let's take it offline"
There will be layoffs,We will expereince corporate synergies
Loads of people will be fired soon,The company is downsizing
It's been too long why don't you answer?,Kind reminder
You are wasting my time,Let's take this offline
This is nit the time nor place for this,Let's take this offline
"Why don't you try to solve the task at hand, instead of pushing your grandiose plans to solve problems nobody asked you to solve?",I think that would be a very impactful second phase but I suggest we keep your eyes on the prerequisites to make sure we can deliver the entire project on time
t me check and I’ll get to you,I will need to socialize it with a few other stakeholders and revert
What took you so long?,Thanks for the quick turnaround
The idea is useless and we don't want to do it ,"The idea is very interesting,  but we will need to check if we have the sufficient bandwidth to prioritize it."
Why you are not answering ,Just a kind reminder
Have you completed the task?,I want to touch base on our task
"I need you to do this with me for the first time, I have no idea what I'm doing",Can you please onboard me
We have a good improvement,We were able to achieve significant uplift in performance
I didn’t understand any of the 3 options listed,Can you please elaborate on the 3 options you suggested?
I don't know,Let's talk about it later
Let's meet to discuss project status,I've set a meeting to have a discussion around status on the project
I hate it that you didn't share this information with me,Thank you for sharing! Let's keep each other well informed in the future as well!